{
    "schema_version": "1.0.0",
    "job_id": "job_001",
    "updated_at": "2026-05-06T10:02:30Z",
    "artifacts": {
        "metadata": {
            "object_key": "jobs/job_001/artifacts/metadata.json",
            "produced_by": "media_metadata",
            "created_at": "2026-05-06T10:00:05Z",
            "content_type": "application/json",
            "size_bytes": 912
        },
        "proxy": {
            "object_key": "jobs/job_001/artifacts/proxy.mp4",
            "produced_by": "proxy_frame_sampling",
            "created_at": "2026-05-06T10:00:10Z",
            "content_type": "video/mp4",
            "size_bytes": 15400321
        },
        "sampled_frames": {
            "object_key": "jobs/job_001/artifacts/sampled_frames.json",
            "produced_by": "proxy_frame_sampling",
            "created_at": "2026-05-06T10:00:10Z",
            "content_type": "application/json",
            "size_bytes": 4096
        },
        "body_tracks_raw": {
            "object_key": "jobs/job_001/artifacts/body_tracks_raw.json",
            "produced_by": "body_detection",
            "created_at": "2026-05-06T10:00:21Z",
            "content_type": "application/json",
            "size_bytes": 12048
        },
        "body_tracks_interpolated": {
            "object_key": "jobs/job_001/artifacts/body_tracks_interpolated.json",
            "produced_by": "track_interpolation",
            "created_at": "2026-05-06T10:00:28Z",
            "content_type": "application/json",
            "size_bytes": 12384
        },
        "reframe_plan_raw": {
            "object_key": "jobs/job_001/artifacts/reframe_plan_raw.json",
            "produced_by": "reframe_planning",
            "created_at": "2026-05-06T10:00:37Z",
            "content_type": "application/json",
            "size_bytes": 10051
        },
        "reframe_plan_smooth": {
            "object_key": "jobs/job_001/artifacts/reframe_plan_smooth.json",
            "produced_by": "easing_smoothing",
            "created_at": "2026-05-06T10:00:47Z",
            "content_type": "application/json",
            "size_bytes": 10392
        },
        "render_plan": {
            "object_key": "jobs/job_001/artifacts/render_plan.json",
            "produced_by": "render_plan_compiler",
            "created_at": "2026-05-06T10:00:55Z",
            "content_type": "application/json",
            "size_bytes": 1433
        },
        "final_9x16": {
            "object_key": "jobs/job_001/outputs/final_9x16.mp4",
            "produced_by": "ffmpeg_renderer",
            "created_at": "2026-05-06T10:02:29Z",
            "content_type": "video/mp4",
            "size_bytes": 49184221
        }
    }
}